{
  "seed": 42,
  "hard": {
    "fixed_seats": [
      {
        "student": "STU001",
        "seat_id": "R1C1"
      }
    ],
    "must_be_adjacent": [
      {
        "students": [
          "STU002",
          "STU003"
        ]
      }
    ],
    "cannot_be_adjacent": [
      {
        "students": [
          "STU004",
          "STU005"
        ]
      }
    ],
    "min_distance": []
  },
  "soft": {
    "vision_front": {
      "enabled": true,
      "weight": 20
    },
    "height_back": {
      "enabled": true,
      "weight": 1
    },
    "randomize": {
      "enabled": true,
      "weight": 1
    },
    "score_balance": {
      "enabled": true,
      "weight": 1
    },
    "fair_rotation": {
      "enabled": true,
      "weight": 10,
      "avoid_repeating_categories": [
        "front",
        "back",
        "side",
        "corner",
        "near_window",
        "near_door",
        "near_ac"
      ],
      "lookback": 4
    },
    "avoid_recent_neighbors": {
      "enabled": true,
      "weight": 10,
      "relation_types": [
        "desk_mate",
        "adjacent_any"
      ],
      "lookback": 4,
      "max_recent_count": 1,
      "within_distance": 2
    },
    "cooling": {
      "enabled": false,
      "weight": 5,
      "cooling_period": 3,
      "relation_types": [
        "desk_mate",
        "adjacent_any"
      ]
    }
  },
  "groups": []
}
