{
  "groups": [
    {
      "name": "Alpha",
      "separate": false,
      "students": [
        "STU001",
        "STU006",
        "STU011"
      ]
    },
    {
      "name": "Beta",
      "separate": true,
      "students": [
        "STU002",
        "STU007",
        "STU012"
      ]
    }
  ],
  "hard": {},
  "seed": 396170,
  "soft": {}
}
